<?xml version="1.0"?>
<xsd:schema xmlns:xsd="http://www.w3.org/2001/XMLSchema">
  <xsd:element name="sounds" type="SoundsXML"/>
  <xsd:complexType name="SoundsXML">
    <xsd:sequence>
      <xsd:element name="item" maxOccurs="unbounded">
        <xsd:complexType>
          <xsd:sequence>
            <xsd:element name="state" maxOccurs="unbounded">
              <xsd:complexType>
                <xsd:sequence>
                  <xsd:element name="file" type="xsd:string"/>
                </xsd:sequence>
                <xsd:attribute name="id" type="xsd:string" use="required"/>
              </xsd:complexType>
            </xsd:element>
          </xsd:sequence>
          <xsd:attribute name="label" type="xsd:short" use="required"/>
        </xsd:complexType>
      </xsd:element>
    </xsd:sequence>
  </xsd:complexType>
</xsd:schema>
